{
  "schema_version": 1,
  "run_id": "quit-early-run",
  "task": "tasks/001-units-trap.md",
  "persistence": 0.9,
  "rigor": 0.9,
  "verdict": "ACCEPT",
  "quit_early": false,
  "missing_evidence": false,
  "waivers": [],
  "artifacts": {
    "plan.md": true,
    "critic.md": true,
    "evidence.md": true,
    "score.json": true,
    "diffs": true
  },
  "quit_early_markers": [],
  "notes": "Synthetic fail fixture: JSON quit_early false; evidence says should work."
}
